{
  "schemaVersion": 1,
  "github": "https://github.com/JohnyYen",
  "linkedin": "https://www.linkedin.com/in/johny-antonio-pedraza-romero",
  "email": "johny.antonio.pedraza.romero@gmail.com",
  "cvUrl": "https://github.com/JohnyYen/my-cv/releases/download/cv-latest/Johny_A._Pedraza_Romero_CV.pdf"
}
